{
  "schema": "smartparse.analysis_eligibility",
  "schema_version": "1.0",
  "manifest": {
    "source": {
      "path": "C:\\Users\\saami\\Downloads\\SmartParse_Final_Git\\phase6\\v2\\fixtures\\macro_regions.c",
      "sha256": "ec3c4c4b2bfc4d11c54b63ba8ada0f3962240bc2f8c434ca9c0ac2d60a793117",
      "bytes": 152,
      "physical_lines": 3,
      "encoding": "UTF-8",
      "original_source_unchanged": true,
      "pre_analysis_sha256": "ec3c4c4b2bfc4d11c54b63ba8ada0f3962240bc2f8c434ca9c0ac2d60a793117"
    },
    "working_directory": "C:\\Users\\saami\\Downloads\\SmartParse_Final_Git",
    "requested_standard": null,
    "include_directories": [],
    "quote_include_root": "C:\\Users\\saami\\Downloads\\SmartParse_Final_Git\\phase6\\v2\\fixtures",
    "macro_definitions": [],
    "locale": {
      "LC_ALL": "C",
      "LANG": "C"
    },
    "include_environment": {
      "CPATH": null,
      "C_INCLUDE_PATH": null,
      "INCLUDE": null,
      "SDKROOT": null
    },
    "tool_contexts": {
      "compiler": {
        "compiler": {
          "path": "C:\\android-sdk\\ndk\\26.3.11579264\\toolchains\\llvm\\prebuilt\\windows-x86_64\\bin\\clang.exe",
          "backend": "clang",
          "version": "Android (11349228, based on r487747e) clang version 17.0.2 (https://android.googlesource.com/toolchain/llvm-project d9f89f4d16663d5012e5c09495f3b30ece3d2362)",
          "flags": [
            "-Wall",
            "-Wextra",
            "-Wparentheses",
            "-fdiagnostics-show-option",
            "-fdiagnostics-color=never",
            "-ferror-limit=0",
            "-fno-diagnostics-fixit-info"
          ]
        },
        "requested_standard": null,
        "standard_selection": "compiler_default",
        "target": "x86_64-w64-windows-gnu",
        "target_basis": "driver -dumpmachine, no target override supported by this mode",
        "standard_macros": {
          "__SIZEOF_POINTER__": "8",
          "__STDC_VERSION__": "201710L",
          "__STDC__": "1"
        },
        "system_include_paths": [
          "C:/android-sdk/ndk/26.3.11579264/toolchains/llvm/prebuilt/windows-x86_64/lib/clang/17/include",
          "C:/MinGW/mingw32/include",
          "C:/MinGW/include"
        ],
        "enabled_default_checkers": null,
        "checker_selection": "not_requested",
        "probes": {
          "target": {
            "command": [
              "C:\\android-sdk\\ndk\\26.3.11579264\\toolchains\\llvm\\prebuilt\\windows-x86_64\\bin\\clang.exe",
              "-dumpmachine"
            ],
            "status": "completed",
            "returncode": 0,
            "stderr": "",
            "stdout_sha256": "14ca52f473c03e43adcd02ecd2a6da4e554e7261eb736bfcbf935762772e3ba2",
            "stdout_bytes": 23
          },
          "standard_macros": {
            "command": [
              "C:\\android-sdk\\ndk\\26.3.11579264\\toolchains\\llvm\\prebuilt\\windows-x86_64\\bin\\clang.exe",
              "-x",
              "c",
              "-E",
              "-dM",
              "-"
            ],
            "status": "completed",
            "returncode": 0,
            "stderr": "",
            "stdout_sha256": "31767a9fe8821454353b4c28b5a156ea1ed7aa73036ce6a7c710e2fb6cc8f78f",
            "stdout_bytes": 13075
          },
          "include_search": {
            "command": [
              "C:\\android-sdk\\ndk\\26.3.11579264\\toolchains\\llvm\\prebuilt\\windows-x86_64\\bin\\clang.exe",
              "-x",
              "c",
              "-E",
              "-v",
              "-"
            ],
            "status": "completed",
            "returncode": 0,
            "stderr": "Android (11349228, based on r487747e) clang version 17.0.2 (https://android.googlesource.com/toolchain/llvm-project d9f89f4d16663d5012e5c09495f3b30ece3d2362)\r\nTarget: x86_64-w64-windows-gnu\r\nThread model: posix\r\nInstalledDir: C:/android-sdk/ndk/26.3.11579264/toolchains/llvm/prebuilt/windows-x86_64/bin\r\n (in-process)\r\n \"C:/android-sdk/ndk/26.3.11579264/toolchains/llvm/prebuilt/windows-x86_64/bin/clang.exe\" -cc1 -triple x86_64-w64-windows-gnu -E -disable-free -clear-ast-before-backend -disable-llvm-verifier -discard-value-names -main-file-name - -mrelocation-model pic -pic-level 2 -mframe-pointer=none -fmath-errno -ffp-contract=on -fno-rounding-math -mconstructor-aliases -mms-bitfields -funwind-tables=2 -target-cpu x86-64 -tune-cpu generic -debugger-tuning=gdb -v -fcoverage-compilation-dir=C:/Users/saami/Downloads/SmartParse_Final_Git -resource-dir C:/android-sdk/ndk/26.3.11579264/toolchains/llvm/prebuilt/windows-x86_64/lib/clang/17 -internal-isystem C:/android-sdk/ndk/26.3.11579264/toolchains/llvm/prebuilt/windows-x86_64/lib/clang/17/include -internal-isystem C:/MinGW/mingw32/include -internal-isystem C:/MinGW/mingw32/usr/include -internal-isystem C:/MinGW/include -fdebug-compilation-dir=C:/Users/saami/Downloads/SmartParse_Final_Git -ferror-limit 19 -fno-use-cxa-atexit -fgnuc-version=4.2.1 -exception-model=seh -faddrsig -o - -x c -\r\nclang -cc1 version 17.0.2 based upon LLVM 17.0.2 default target x86_64-w64-windows-gnu\r\nignoring nonexistent directory \"C:/MinGW/mingw32/usr/include\"\r\n#include \"...\" search starts here:\r\n#include <...> search starts here:\r\n C:/android-sdk/ndk/26.3.11579264/toolchains/llvm/prebuilt/windows-x86_64/lib/clang/17/include\r\n C:/MinGW/mingw32/include\r\n C:/MinGW/include\r\nEnd of search list.\r\n",
            "stdout_sha256": "4bf30b2f3e0bd46aad5129c162b8d6b0449442808e67c754bf7e0bb3505eecc1",
            "stdout_bytes": 132
          }
        },
        "capabilities": {
          "syntax_only": "verified by existing compiler discovery",
          "validated_optional_flags": [
            "-Wall",
            "-Wextra",
            "-Wparentheses",
            "-fdiagnostics-show-option",
            "-fdiagnostics-color=never",
            "-ferror-limit=0",
            "-fno-diagnostics-fixit-info"
          ],
          "target_query": "observed",
          "standard_metadata": "observed",
          "include_search": "observed",
          "enabled_checker_list": "not requested",
          "ast_inventory": "completed"
        }
      }
    },
    "warning_options": {
      "compiler": [
        "-Wall",
        "-Wextra",
        "-Wparentheses"
      ],
      "analyzer": []
    },
    "checker_options": "driver defaults; observed enabled list in analyzer context, unknown if query unavailable"
  },
  "stages": {
    "compiler": {
      "completion": "completed",
      "returncode": 0,
      "frontend_accepted": true
    },
    "analyzer": {
      "completion": "not_attempted",
      "returncode": null
    },
    "preprocessing_probe": {
      "command": [
        "C:\\android-sdk\\ndk\\26.3.11579264\\toolchains\\llvm\\prebuilt\\windows-x86_64\\bin\\clang.exe",
        "-x",
        "c",
        "-E",
        "C:\\Users\\saami\\Downloads\\SmartParse_Final_Git\\phase6\\v2\\fixtures\\macro_regions.c"
      ],
      "status": "completed",
      "returncode": 0,
      "stderr": "",
      "stdout_sha256": "9d5ae88b1f483f8f902c8031d83c17fb2f6f3bfbc3ff84a5ff1438a51218f67a",
      "stdout_bytes": 398
    }
  },
  "blockers": [],
  "region_inventory": {
    "status": "completed",
    "regions": [
      {
        "id": "function:91:ordinary_function",
        "kind": "function",
        "name": "ordinary_function",
        "mapping": "physical-main-file-byte-offsets",
        "start_byte": 91,
        "end_byte_exclusive": 151,
        "start_line": 3,
        "end_line": 3,
        "reliability": "validated_ast_range"
      }
    ],
    "exclusions": [
      {
        "name": "generated_function",
        "reason": "macro-expanded or missing physical location"
      }
    ],
    "basis": "Clang AST offsets verified against main-file bytes; partial AST never establishes analysis coverage",
    "probe": {
      "command": [
        "C:\\android-sdk\\ndk\\26.3.11579264\\toolchains\\llvm\\prebuilt\\windows-x86_64\\bin\\clang.exe",
        "-x",
        "c",
        "-fsyntax-only",
        "-Wall",
        "-Wextra",
        "-Wparentheses",
        "-fdiagnostics-show-option",
        "-fdiagnostics-color=never",
        "-ferror-limit=0",
        "-fno-diagnostics-fixit-info",
        "-Xclang",
        "-ast-dump=json",
        "C:\\Users\\saami\\Downloads\\SmartParse_Final_Git\\phase6\\v2\\fixtures\\macro_regions.c"
      ],
      "status": "completed",
      "returncode": 0,
      "stderr": "",
      "stdout_sha256": "19966fdff522203e72a65d013817d9e8dfabee26d0f21c46827bcac8c835c550",
      "stdout_bytes": 11449
    },
    "capability_probe": {
      "command": [
        "C:\\android-sdk\\ndk\\26.3.11579264\\toolchains\\llvm\\prebuilt\\windows-x86_64\\bin\\clang.exe",
        "-x",
        "c",
        "-fsyntax-only",
        "-Wall",
        "-Wextra",
        "-Wparentheses",
        "-fdiagnostics-show-option",
        "-fdiagnostics-color=never",
        "-ferror-limit=0",
        "-fno-diagnostics-fixit-info",
        "-Xclang",
        "-ast-dump=json",
        "-"
      ],
      "status": "completed",
      "returncode": 0,
      "stderr": "",
      "stdout_sha256": "7b934e3669f4e6f1de9357be798e5fc44fac512acfd97a864f7ae4bf49e5a0e7",
      "stdout_bytes": 5047
    },
    "configured_definitions_complete": false
  },
  "regions": [
    {
      "id": "translation_unit",
      "kind": "translation_unit",
      "name": null,
      "start_line": 1,
      "end_line": 3,
      "mapping": "original physical file; configured preprocessing only",
      "compiler_coverage": {
        "status": "completed",
        "reason": "Configured frontend accepted this translation unit; not a static-analysis or all-configurations claim."
      },
      "analyzer_coverage": {
        "status": "not_attempted",
        "reason": "Pass was not requested."
      }
    },
    {
      "id": "function:91:ordinary_function",
      "kind": "function",
      "name": "ordinary_function",